{
  "kind": "SpecDDBenchmarkDataset",
  "schemaVersion": "1.0.0",
  "planSha256": "d3e8b96b34c58022747ee366e73f1a3671317f67d78e8a0abb2f82b5df4fea5c",
  "samples": [
    {
      "configurationRef": "baseline",
      "configurationSha256": "e4e94fb6984b02b738dd8bb75a8041cb8428a27d0c6a2cd5343fa3fe646ccb95",
      "taskSha256": "2101ff99a1efff65de32798cee9624d6c261e267ee1298ad30ab4ff63a002b1d",
      "repetition": 1,
      "controlPlane": {
        "schemaVersion": "1.0.0",
        "kind": "SpecDDControlPlane",
        "lifecycle": "draft",
        "metadata": {
          "id": "benchmark-local-control",
          "name": "Manual Review Control",
          "description": "A minimal manually triggered single-role workflow.",
          "version": "1.0.0"
        },
        "project": {
          "id": "example-project",
          "source": "context/project-definition.json",
          "version": "1.0.0"
        },
        "harnesses": [
          {
            "id": "project-harness",
            "source": ".agents/REGISTRY.md",
            "contractVersion": "1.0.0",
            "enabled": true
          }
        ],
        "capabilityBindings": [],
        "agentRoles": [
          {
            "id": "reviewer",
            "title": "Reviewer",
            "purpose": "Review work under the project Harness.",
            "harnessRef": "project-harness",
            "capabilityBindingRefs": [],
            "policyRefs": []
          }
        ],
        "workflows": [
          {
            "id": "manual-review",
            "name": "Manual Review",
            "purpose": "Perform one review when a human starts it.",
            "graphRef": "manual-review-graph",
            "triggers": [
              {
                "kind": "manual"
              }
            ],
            "inputArtifactRefs": [],
            "outputArtifactRefs": [],
            "policyRefs": []
          }
        ],
        "graphs": [
          {
            "id": "manual-review-graph",
            "name": "Manual Review Graph",
            "description": "One finite review node.",
            "entryNodeId": "evaluate",
            "terminalNodeIds": [
              "evaluate"
            ],
            "nodes": [
              {
                "id": "evaluate",
                "name": "Evaluate pinned score fixtures",
                "kind": "eval",
                "evalGateRef": "score-conformance",
                "inputArtifactRefs": [],
                "outputArtifactRefs": [],
                "policyRefs": []
              }
            ],
            "edges": []
          }
        ],
        "approvals": [],
        "policies": [],
        "failureRoutes": [],
        "retries": [],
        "evalGates": [
          {
            "id": "score-conformance",
            "evalRef": "score-conformance",
            "mode": "required",
            "requiredOutcome": "pass"
          }
        ],
        "artifactContracts": [],
        "runtimeHints": []
      },
      "events": [
        {
          "runId": "local-baseline-1",
          "workflowRef": "manual-review",
          "graphRef": "manual-review-graph",
          "nodeRef": "evaluate",
          "controlPlaneSha256": "e556e480476da5221bd4f369fa8b1db40f81dfd69a42823dc90024226bc7cf3c",
          "inputRef": "sha256:2101ff99a1efff65de32798cee9624d6c261e267ee1298ad30ab4ff63a002b1d",
          "agentRef": null,
          "capabilityRefs": [],
          "runtime": "node-test",
          "model": null,
          "harnessRef": null,
          "schemaVersion": "1.0.0",
          "kind": "SpecDDRunEvent",
          "id": "evaluation.start",
          "timestamp": "2026-09-05T11:45:33.221Z",
          "source": {
            "adapter": "eval-result-v1",
            "eventId": "evaluation.start"
          },
          "event": "eval.started",
          "data": {
            "attempt": 1,
            "evalRef": "score-conformance"
          }
        },
        {
          "runId": "local-baseline-1",
          "workflowRef": "manual-review",
          "graphRef": "manual-review-graph",
          "nodeRef": "evaluate",
          "controlPlaneSha256": "e556e480476da5221bd4f369fa8b1db40f81dfd69a42823dc90024226bc7cf3c",
          "inputRef": "sha256:2101ff99a1efff65de32798cee9624d6c261e267ee1298ad30ab4ff63a002b1d",
          "agentRef": null,
          "capabilityRefs": [],
          "runtime": "node-test",
          "model": null,
          "harnessRef": null,
          "schemaVersion": "1.0.0",
          "kind": "SpecDDRunEvent",
          "id": "evaluation.end",
          "timestamp": "2026-09-05T11:45:34.133Z",
          "source": {
            "adapter": "eval-result-v1",
            "eventId": "evaluation.end"
          },
          "event": "eval.completed",
          "data": {
            "attempt": 1,
            "result": {
              "schemaVersion": "1.0.0",
              "kind": "SpecDDEvalResult",
              "runId": "local-baseline-1",
              "inputRef": "sha256:2101ff99a1efff65de32798cee9624d6c261e267ee1298ad30ab4ff63a002b1d",
              "observedAt": "2026-09-05T11:45:34.133Z",
              "evalRef": "score-conformance",
              "evalVersion": "1.0.0",
              "definitionSha256": "7fa33298ee00ac980bebb7b10d8988654956cb4d70fcdebd8fc6a5f8d28b5023",
              "adapter": "local-exit-v1",
              "outcome": "pass",
              "score": 1,
              "label": "passed",
              "evidence": {
                "sha256": "5ea76e30d4eb60d82dfed3a50e0533e9393e2a641074d6052e54ed5d6761c018",
                "bytes": 301
              },
              "error": null
            }
          }
        }
      ],
      "cost": null
    },
    {
      "configurationRef": "candidate",
      "configurationSha256": "8b24e18054b2d631eab7305165964e2d89be17575d96a1d54d3d8506dbf9e192",
      "taskSha256": "2101ff99a1efff65de32798cee9624d6c261e267ee1298ad30ab4ff63a002b1d",
      "repetition": 1,
      "controlPlane": {
        "schemaVersion": "1.0.0",
        "kind": "SpecDDControlPlane",
        "lifecycle": "draft",
        "metadata": {
          "id": "benchmark-local-control",
          "name": "Manual Review Control",
          "description": "A minimal manually triggered single-role workflow.",
          "version": "1.0.0"
        },
        "project": {
          "id": "example-project",
          "source": "context/project-definition.json",
          "version": "1.0.0"
        },
        "harnesses": [
          {
            "id": "project-harness",
            "source": ".agents/REGISTRY.md",
            "contractVersion": "1.0.0",
            "enabled": true
          }
        ],
        "capabilityBindings": [],
        "agentRoles": [
          {
            "id": "reviewer",
            "title": "Reviewer",
            "purpose": "Review work under the project Harness.",
            "harnessRef": "project-harness",
            "capabilityBindingRefs": [],
            "policyRefs": []
          }
        ],
        "workflows": [
          {
            "id": "manual-review",
            "name": "Manual Review",
            "purpose": "Perform one review when a human starts it.",
            "graphRef": "manual-review-graph",
            "triggers": [
              {
                "kind": "manual"
              }
            ],
            "inputArtifactRefs": [],
            "outputArtifactRefs": [],
            "policyRefs": []
          }
        ],
        "graphs": [
          {
            "id": "manual-review-graph",
            "name": "Manual Review Graph",
            "description": "One finite review node.",
            "entryNodeId": "evaluate",
            "terminalNodeIds": [
              "evaluate"
            ],
            "nodes": [
              {
                "id": "evaluate",
                "name": "Evaluate pinned score fixtures",
                "kind": "eval",
                "evalGateRef": "score-conformance",
                "inputArtifactRefs": [],
                "outputArtifactRefs": [],
                "policyRefs": []
              }
            ],
            "edges": []
          }
        ],
        "approvals": [],
        "policies": [],
        "failureRoutes": [],
        "retries": [],
        "evalGates": [
          {
            "id": "score-conformance",
            "evalRef": "score-conformance",
            "mode": "required",
            "requiredOutcome": "pass"
          }
        ],
        "artifactContracts": [],
        "runtimeHints": []
      },
      "events": [
        {
          "runId": "local-candidate-1",
          "workflowRef": "manual-review",
          "graphRef": "manual-review-graph",
          "nodeRef": "evaluate",
          "controlPlaneSha256": "e556e480476da5221bd4f369fa8b1db40f81dfd69a42823dc90024226bc7cf3c",
          "inputRef": "sha256:2101ff99a1efff65de32798cee9624d6c261e267ee1298ad30ab4ff63a002b1d",
          "agentRef": null,
          "capabilityRefs": [],
          "runtime": "node-test",
          "model": null,
          "harnessRef": null,
          "schemaVersion": "1.0.0",
          "kind": "SpecDDRunEvent",
          "id": "evaluation.start",
          "timestamp": "2026-09-05T11:45:34.166Z",
          "source": {
            "adapter": "eval-result-v1",
            "eventId": "evaluation.start"
          },
          "event": "eval.started",
          "data": {
            "attempt": 1,
            "evalRef": "score-conformance"
          }
        },
        {
          "runId": "local-candidate-1",
          "workflowRef": "manual-review",
          "graphRef": "manual-review-graph",
          "nodeRef": "evaluate",
          "controlPlaneSha256": "e556e480476da5221bd4f369fa8b1db40f81dfd69a42823dc90024226bc7cf3c",
          "inputRef": "sha256:2101ff99a1efff65de32798cee9624d6c261e267ee1298ad30ab4ff63a002b1d",
          "agentRef": null,
          "capabilityRefs": [],
          "runtime": "node-test",
          "model": null,